{"$schema":"https://json-schema.org/draft/2020-12/schema","$id":"https://schemas.rotprods.dev/clever/v1/perception.schema.json","type":"object","additionalProperties":false,"required":["contractVersion","observationId","kind","principal","deviceId","classification","consentActive","permissionGrantId","observedAt"],"properties":{"contractVersion":{"$ref":"https://schemas.rotprods.dev/clever/v1/common.schema.json#/$defs/contractVersion"},"observationId":{"type":"string","minLength":1},"kind":{"type":"string","enum":["OBSERVATION_KIND_AUDIO","OBSERVATION_KIND_SCREEN","OBSERVATION_KIND_CAMERA","OBSERVATION_KIND_LOCATION","OBSERVATION_KIND_DEVICE_SENSOR"]},"principal":{"$ref":"https://schemas.rotprods.dev/clever/v1/common.schema.json#/$defs/principalRef"},"deviceId":{"type":"string","minLength":1},"classification":{"$ref":"https://schemas.rotprods.dev/clever/v1/common.schema.json#/$defs/classification"},"consentActive":{"type":"boolean"},"permissionGrantId":{"type":"string","minLength":1},"contentRef":{"type":"string"},"inlinePayload":{"$ref":"https://schemas.rotprods.dev/clever/v1/common.schema.json#/$defs/payload"},"observedAt":{"$ref":"https://schemas.rotprods.dev/clever/v1/common.schema.json#/$defs/timestamp"},"provenance":{"type":"array","items":{"$ref":"https://schemas.rotprods.dev/clever/v1/common.schema.json#/$defs/provenanceRef"}}}}
