{"contractVersion":{"major":1,"minor":0},"observationId":"obs_demo","kind":"OBSERVATION_KIND_AUDIO","principal":{"userId":"user_demo","deviceId":"omi_demo"},"deviceId":"omi_demo","classification":"DATA_CLASSIFICATION_SENSITIVE","consentActive":true,"permissionGrantId":"grant_microphone_demo","contentRef":"memory://transient/audio/demo","observedAt":"2026-09-01T00:00:00Z","provenance":[{"sourceRepo":"BasedHardware/omi","sourceCommit":"e1eca38ff28758d58cde43045691c8ba479063e9"}]}
